Item type,Authors,Title,Date published
Journal Article,"Tyrtyshnikov EE,Egorov AA",Numerical certification of algorithms and programs,1994
Journal Article,Zhang YH,The solubility of additive and multiplicative inverse eigenvalue problems,1993
Journal Article,Xia YS,A homotopy method for solving generalized inverse eigenvalue problems,1993
Journal Article,"Feng GC,Wu W,Zhang SG",The eigenvalue problem equivalent to multivariate polynomial system,1993
Journal Article,Lenard C,Relating Newton's method to projection methods for eigenvalue problems,1993
Journal Article,"Bai Z,Demmel J,McKenney A",On computing condition numbers for the nonsymmetric eigenproblem,1993
Journal Article,"Demmel J,Kagstroem B",The generalized Schur decomposition of an arbitrary pencil $A-\lambda B$: robust software with error bounds and applications. II. Software and applications,1993
Journal Article,"Demmel J,Kagstroem B",The generalized Schur decomposition of an arbitrary pencil $A-\lambda B$: robust software with error bounds and applications. I. Theory and algorithms,1993
Journal Article,"Duff I,Scott J",Computing selected eigenvalues of sparse unsymmetric matrices using subspace iteration,1993
Journal Article,Xu SF,A stability analysis of the Jacobi matrix inverse eigenvalue problem,1993
Journal Article,"Park H,Hari V",A real algorithm for the Hermitian eigenvalue decomposition,1993
Journal Article,Stetter HJ,Multivariate polynomial equations as matrix eigenproblems,1993
Journal Article,"Garratt TJ,Moore G,Spence A",A generalised Cayley transform for the numerical detection of Hopf bifurcations in large systems,1993
Journal Article,Hasegawa H,Right-hand side dependence of the preconditioned conjugate gradient method,1993
Journal Article,"Zhang YH,Zhu BR",An estimate for the eigenvalues of a symmetric matrix,1993
Journal Article,Zhu X,The spectral analysis of a class of symplectic-invariant matrices and the convergence analysis of the basic iteration process,1993
Journal Article,"Ikebe Y,Asai N,Harada M,Takanashi K,Kikuchi Y,Cai D",Eigenvalue problems for infinite compact complex symmetric tridiagonal matrices,1993
Journal Article,Xie DX,Inverse eigenvalue problems on a linear manifold,1993
Journal Article,"Riveros VS,Patnaik R",Some results on eigenvalues and eigenvectors of a matrix using the $QR$ method,1993
Journal Article,Guo DH,The relation between the eigenvalues of the TOR iteration and the Jacobi iteration for a class of $P$-weakly cyclic matrices,1993
Journal Article,"Li BH,Jiang CJ",A new method for computing all eigenvalues and eigenvectors of a real symmetric matrix,1993
Journal Article,"Zhang YQ,Wang WL",A calculation method for derivatives of eigenvectors corresponding to repeated eigenvalues,1993
Journal Article,"Wang WL,Hu HC",A small parameter method with repeated eigenvalues,1993
Journal Article,"Knyazev A,Sharapov IA",Variational Rayleigh quotient iteration methods for a symmetric eigenvalue problem,1993
Journal Article,Malyshev A,On iterative refinement for the spectral decomposition of symmetric matrices,1993
Journal Article,Garvey SD,An efficient method for solving the eigenvalue problem for matrices having a skew-symmetric (or skew-Hermitian) component of low rank,1993
Journal Article,"Hari V,Rhee NH",A matrix pair of an almost diagonal skew-symmetric matrix and a symmetric positive definite matrix,1993
Journal Article,"Veselic K,Slapnicar I",Floating-point perturbations of Hermitian matrices,1993
Journal Article,Ruggiero V,Polynomial preconditioning on vector computers,1993
Journal Article,"Zhu BR,Jackson KR,Chan RP",Inverse spectrum problems for block Jacobi matrix,1993
Journal Article,"Van der Vorst H,Vuik C",The superlinear convergence behaviour of GMRES,1993
Journal Article,"Goetze J,Paul S,Sauer M",An efficient Jacobi-like algorithm for parallel eigenvalue computation,1993
Journal Article,Ren LW,Perturbation analysis of nonhomogeneous eigenvalue problems,1993
Journal Article,Kagstroem B,"A direct method for reordering eigenvalues in the generalized real Schur form of a regular matrix pair $(A,B)$",1993
Journal Article,"Zheng DS,Xu L",An algorithm for Hermitian indefinite generalized eigenvalue problems,1993
Journal Article,"Overton ML,Womersley RS",Optimality conditions and duality theory for minimizing sums of the largest eigenvalues of symmetric matrices,1993
Journal Article,Zhang ZY,A parallel iterative method for solving symmetric tridiagonal extreme eigenpair problems,1993
Journal Article,Kucherov AB,On a lower bound for the minimal eigenvalue of a symmetric block matrix,1993
Journal Article,Batterson S,The dynamics of eigenvalue computatio,
Journal Article,"Nekooie B,Fan MK",A quadratically convergent local algorithm on minimizing sums of the largest eigenvalues of a symmetric matrix,1993
Journal Article,"Borges CF,Gragg W",A parallel divide and conquer algorithm for the generalized real symmetric definite tridiagonal eigenproblem,1993
Journal Article,"Ikebe Y,Kikuchi Y,Fujishiro I,Asai N,Takanashi K,Harada M",The eigenvalue problem for infinite compact complex symmetric matrices with application to the numerical computation of complex zeros of $J_0(z)-iJ_1(z)$ and of Bessel functions $J_m(z)$ of any real order $m$,1993
Journal Article,Yang H,Conjugate gradient methods for the Rayleigh quotient minimization of generalized eigenvalue problems,1993
Journal Article,"Cliffe KA,Garratt TJ,Spence A",Eigenvalues of the discretized Navier-Stokes equation with application to the detection of Hopf bifurcations,1993
Journal Article,"Ahues M,Hocine F",Finite element error bounds in spectral approximations,1993
Journal Article,Heyman DP,A direct algorithm for computing the stationary distribution of a $p$-cyclic Markov chain,1993
Journal Article,Szyld DB,Local convergence of (exact and inexact) iterative aggregation,1993
Journal Article,Meyer CD,The character of a finite Markov chain,1993
Journal Article,Chatelin F,The influence of nonnormality on matrix computations,1993
Journal Article,Barlow JL,Error bounds for the computation of null vectors with applications to Markov chains,1993
Book,,"Linear algebra, Markov chains, and queueing models",1993
Journal Article,Heinrichs W,Finite element preconditioning for spectral multigrid methods,1993
Journal Article,Lang B,A parallel algorithm for reducing symmetric banded matrices to tridiagonal form,1993
Journal Article,Scherzer O,A parameter choice for Tikhonov regularization for solving nonlinear inverse problems leading to optimal convergence rates,1993
Journal Article,"Rhee NH,Hari V",On the global and cubic convergence of a quasi-cyclic Jacobi method,1993
Journal Article,"Kartyshov SV,Yukhno LF",Some modifications of the Newton method for solving a nonlinear spectral problem,1993
Journal Article,"Nayar N,Ortega JM",Computation of selected eigenvalues of generalized eigenvalue problems,1993
Journal Article,"Bunse-Gerstner A,Byers R,Mehrmann V",Numerical methods for simultaneous diagonalization,1993
Journal Article,"Andrew AL,Chu EK,Lancaster P",Derivatives of eigenvalues and eigenvectors of matrix functions,1993
Journal Article,Zupan A,Diagonalization of a symmetric matrix using the Jacobi method,1993
Journal Article,Rump SM,Zur Aussen- und Inneneinschliessung von Eigenwerten bei toleranzbehafteten Matrizen,1993
Journal Article,Maximenko EA,Taylor-Verfahren fuer das algebraische Eigenwertproblem,1993
Journal Article,Watkins D,Some perspectives on the eigenvalue problem,1993
Journal Article,"Ammar GS,Benner P,Mehrmann V",A multishift algorithm for the numerical solution of algebraic Riccati equations,1993
Journal Article,Jarre F,An interior-point method for minimizing the maximum eigenvalue of a linear combination of matrices,1993
Journal Article,"Pan V,Demmel J",A new algorithm for the symmetric tridiagonal eigenvalue problem,1993
Journal Article,"Lue ZH,Shao C,Feng ZD",High accuracy step-by-step perturbation method of the generalized eigenvalue problem and its application to the parametric history analysis of structural vibration characteristics,1993
Journal Article,Jessup E,A case against a divide and conquer approach to the nonsymmetric eigenvalue problem,1993
Book,Chatelin F,Eigenvalues of matrices,1993
Journal Article,"Chu MT,Watterson JL",On a multivariate eigenvalue problem. I. Algebraic theory and a power method,1993
Journal Article,"Chan RH,Yeung MC",Circulant preconditioners for complex Toeplitz matrices,1993
Journal Article,"Cai XC,Widlund OB",Multiplicative Schwarz algorithms for some nonsymmetric and indefinite problems,1993
Journal Article,Reichel L,Construction of polynomials that are orthogonal with respect to a discrete bilinear form,1993
Journal Article,Du YY,The block Davidson-Lanczos method for solving large real-symmetric eigenproblems,1993
Journal Article,Yu CH,A convergence condition for diagonal elements in the shifted symmetric QL algorithm,1993
Journal Article,"Cliffe KA,Garratt TJ,Spence A",A modified Cayley transform for the discretized Navier-Stokes equations,1993
Journal Article,Barlow JL,Error bounds for the computation of null vectors with applications to Markov chains,1993
Journal Article,Hacon D,Jacobi's method for skew-symmetric matrices,1993
Journal Article,Sun JG,Backward perturbation analysis of certain characteristic subspaces,1993
Journal Article,"Okamoto Y,Maris HJ",A novel algorithm for calculation of the extreme eigenvalues of large Hermitian matrices,1993
Journal Article,"Zhang ZN,Chen WH",Applications of squarefree decompositions of polynomials to matrix computations,1993
Journal Article,"Prosen T,Robnik M",Energy level statistics in the transition region between integrability and chaos,1993
Journal Article,Patel RV,On computing the eigenvalues of a symplectic pencil,1993
Journal Article,Malyshev A,Parallel algorithm for solving some spectral problems of linear algebra,1993
Journal Article,Fan MK,A quadratically convergent local algorithm on minimizing the largest eigenvalue of a symmetric matrix,1993
Journal Article,"Boyd S,El Ghaoui L",Method of centers for minimizing generalized eigenvalues,1993
Journal Article,"Bai Z,Zha H",A new preprocessing algorithm for the computation of the generalized singular value decomposition,1993
Journal Article,"Beam RM,Warming RF",The asymptotic spectra of banded Toeplitz and quasi-Toeplitz matrices,1993
Journal Article,Ikramov KD,On the calculation of the eigenvalues of real block matrices of a special class,1993
Journal Article,Gragg W,"Positive definite Toeplitz matrices, the Arnoldi process for isometric operators, and Gaussian quadrature on the unit circle",1993
Journal Article,Sogo K,Toda molecule equation and quotient-difference method,1993
Journal Article,Takeda E,A note on consistent adjustments of pairwise comparison judgments,1993
Journal Article,"Amodio P,Brugnano L,Politi T",Parallel factorizations for tridiagonal matrices,1993
Journal Article,"Manteuffel T,Otto J",Optimal equivalent preconditioners,1993
Journal Article,"Brezinski C,Sadok H",Lanczos-type algorithms for solving systems of linear equations,1993
Journal Article,Xu YF,The inverse eigenvalue problem for a class of special matrices,1993
Journal Article,Koma T,A new Monte Carlo power method for the eigenvalue problem of transfer matrices,1993
Journal Article,"Li K,Li TY",An algorithm for symmetric tridiagonal eigenproblems: divide and conquer with homotopy continuation,1993
Journal Article,"Morgan R,Scott DS",Preconditioning the Lanczos algorithm for sparse symmetric eigenvalue problems,1993
Journal Article,"Dongarra JJ,Sidani M",A parallel algorithm for the nonsymmetric eigenvalue problem,1993
Journal Article,Huckle T,Some aspects of circulant preconditioners,1993
Journal Article,Wang XM,Generalized extrapolation principle and convergence of some generalized iterative methods,1993
Journal Article,"Helmberg G,Wagner P,Veltkamp G",On Faddeev-Leverrier's methods for the computation of the characteristic polynomial of a matrix and of eigenvectors,1993
Journal Article,"Lancaster P,Ye Q",Rayleigh-Ritz and Lanczos methods for symmetric matrix pencils,1993
Journal Article,"Helton JW,Woerdeman HJ",Symmetric Hankel operators: minimal norm extensions and eigenstructures,1993
Journal Article,Barlow JL,Error analysis of update methods for the symmetric eigenvalue problem,1993
Journal Article,"Ku T,Kuo CC",Spectral properties of preconditioned rational Toeplitz matrices: the nonsymmetric case,1993
Journal Article,"Bini DA,Favati P",On a matrix algebra related to the discrete Hartley transform,1993
Journal Article,Kaufman L,An algorithm for the banded symmetric generalized matrix eigenvalue problem,1993
Journal Article,Sherif N,On optimal symmetric orthogonalisation and square roots of a normal matrix,1993
Journal Article,Wang XM,Generalized Stein-Rosenberg theorems for the regular splittings and convergence of some generalized iterative methods,1993
Journal Article,"Chung KL,Yan WM",Solving the symmetric tridiagonal eigenvalue problem on hypercubes,1993
Journal Article,Faybusovich L,Hamiltonian and system-theoretic properties of the $HR$-algorithm,1993
Journal Article,Leipnik RB,Partial differential equations for eigenvalues: sensitivity and perturbation analysis,1993
Journal Article,"Li K,Li TY",A homotopy algorithm for a symmetric generalized eigenproblem,1993
Journal Article,Starke G,Fields of values and the ADI method for nonnormal matrices,1993
Journal Article,"Elsner L,Neumann M",Monotonic sequences and rates of convergence of asynchronized iterative methods,1993
Journal Article,Zha H,Some properties of the quotient singular value decomposition,1993
Journal Article,Xu SF,A homotopy algorithm for solving the inverse eigenvalue problem for complex symmetric matrices,1993
Journal Article,Yang YG,An improved eigenvalue perturbation bound on a nonnormal matrix and its application in robust stability analysis,1993
Journal Article,Trench WF,A note on computing eigenvalues of banded Hermitian Toeplitz matrices,1993
Journal Article,"Freund RW,Gutknecht MH,Nachtigal NM",An implementation of the look-ahead Lanczos algorithm for non-Hermitian matrices,1993
Journal Article,"Yau ST,Lu YY",Reducing the symmetric matrix eigenvalue problem to matrix multiplications,1993
Journal Article,Zhang ZY,A shifted method for solving symmetric eigenvalue problems,1993
Journal Article,"Rojo O,Soto RL,Rojo H",New eigenvalue estimates for complex matrices,1993
Journal Article,"Parlett B,Le J",Forward instability of tridiagonal $QR$,1993
Journal Article,"Aberth O,Schaefer MJ",Precise matrix eigenvalues using range arithmetic,1993
Journal Article,Van de Geijn R,Deferred shifting schemes for parallel $QR$ methods,1993
Journal Article,Watkins D,Bidirectional chasing algorithms for the eigenvalue problem,1993
Journal Article,"Ku T,Kuo CC",Spectral properties of preconditioned rational Toeplitz matrices,1993
Journal Article,Veselic K,A Jacobi eigenreduction algorithm for definite matrix pairs,1993
Journal Article,Sadkane M,Block-Arnoldi and Davidson methods for unsymmetric large eigenvalue problems,1993
Journal Article,Sadkane M,A block Arnoldi-Chebyshev method for computing the leading eigenpairs of large sparse unsymmetric matrices,1993
Journal Article,"Drmac Z,Hari V",On quadratic convergence bounds for the $J$-symmetric Jacobi method,1993
Journal Article,Swarztrauber PN,A parallel algorithm for computing the eigenvalues of a symmetric tridiagonal matrix,1993
Journal Article,"Fujii M,Furuta T,Seo Y",An inequality for some nonnormal operators---extension to normal approximate eigenvalues,1993
Journal Article,Godunov SK,Algorithm of testing the existness of points of the matrix spectrum on the interval,1992
Journal Article,Pan V,Improving the solution of the symmetric eigenvalue problem and an extension,1992
Book,Nechepurenko YM,\cyr Singulyarnye funktsii matritsy mnogochlenov,1992
Journal Article,Xu SF,A stability analysis of the solutions of general algebraic inverse eigenvalue problems,1992
Journal Article,"Jiang EX,Lam PC",Two kinds of shift using $\beta _2$ in $QL$ algorithm,1992
Journal Article,Sun JG,Condition numbers of a multiple eigenvalue,1992
Journal Article,Chiang YL,On the use of adaptive Chebychev iteration in eigenvalue problem,
Journal Article,"Iguchi H,Natori M,Imai H",Reorthogonalization in the block Lanczos algorithm,1992
Journal Article,"Hari V,Rhee NH",On the quadratic convergence of the Paardekooper method. II,1992
Journal Article,Yu CH,Some results on implicit symmetric $QL$ process,1992
Journal Article,Farkova NA,Application of Faber polynomials to the calculation of eigenvalues,1992
Journal Article,Upor YI,Calculation of zeros of orthogonal polynomials,1992
Journal Article,Schmidt R,Tight lower and upper bounds to first eigenvalues,1992
Journal Article,Kozlowski W,The power method for the generalized eigenvalue problem,1992
Journal Article,Mayer G,Enclosures for eigenvalues and eigenvector,
Journal Article,Godunov SK,Spectral portraits of matrices and criteria of spectrum dichotomy,
Journal Article,Song Y,Estimates of perturbations for eigenvalues of arbitrary matrices,1992
Journal Article,Pesterev AV,The method of guaranteed finding complex conservative systems discrete spectra,1992
Journal Article,"Jones MT,Patrick ML",The Lanczos algorithm for the generalized symmetric eigenproblem on shared-memory architectures,1992
Journal Article,Jessup E,Applying divide and conquer techniques to the nonsymmetric eigenvalue problem,1992
Journal Article,Mokeev VV,On the problem of determining the eigenvalues and eigenvectors of large matrix systems,1992
Journal Article,"Dyakonov EG,Knyazev A",On an iterative method for finding lower eigenvalues,1992
Journal Article,"Knyazev A,Skorokhodov AL",Iterative methods of gradient type in a subspace for a partial symmetric generalized eigenvalue problem,1992
Journal Article,Yu CH,Some results on the symmetric implicit $QL$ algorithm,1992
Journal Article,Behnke H,Bounds for eigenvalues of parameter-dependent matrices,1992
Journal Article,"Killingbeck JP,Jolicard G",Perturbation methods for the matrix eigenproblem,1992
Journal Article,"Murray CW,Racine SC,Davidson ER",Improved algorithms for the lowest few eigenvalues and associated eigenvectors of large matrices,1992
Journal Article,Fu WJ,Using Newton's method and the improved Brauer method to compute the maximum eigenvalue of nonnegative irreducible matrices,1992
Journal Article,"Zhang H,Moss WF",Solution of generalized eigenvalue problems using a parallel subspace iteration algorithm,1992
Journal Article,"Zeng Z,Lin X,Li TY",An efficient parallel homotopy algorithm for nonsymmetric eigenvalue problems with $O(N)$ running time,1992
Journal Article,"Beattie CA,Ribbens CJ",Parallel solution of a generalized symmetric matrix eigenvalue problem,1992
Journal Article,"Geist GA,Jessup E",Parallel implementation of a nonsymmetric tridiagonal eigensolver,1992
Journal Article,Plavka J,The $O(n^3)$ algorithm for a special case of the maximum cost-to-time ratio cycle problem and its coherence with an eigenproblem of a matrix,1992
Journal Article,"Molchanov IN,Popov AV,Khimich AN",An algorithm for solving a partial eigenvalue problem for large profile matrices,1992
Journal Article,"Galligani E,Ruggiero V",Computation of minimal eigenpair in the large sparse generalized eigen-problem using vector computers,1992
Journal Article,Arbenz P,Divide and conquer algorithms for the bandsymmetric eigenvalue problem,1992
Journal Article,"Basermann A,Weidner P",A parallel algorithm for determining all eigenvalues of large real symmetric tridiagonal matrices,1992
Journal Article,Arbenz P,Divide and conquer algorithms for the bandsymmetric eigenvalue problem,1992
Journal Article,Yamaguchi K,Stiff equations derived from diffusion-convection equations,1992
Journal Article,Suzuki T,Inverse iteration method with a complex parameter,1992
Journal Article,Fu WJ,A note on diagonal transformation methods for computing the maximum eigenvalue and corresponding eigenvector of nonnegative irreducible matrices,1992
Journal Article,"Hwang T,Parsons ID",A multigrid method for the generalized symmetric eigenvalue problem. II. Performance evaluation,1992
Journal Article,"Hwang T,Parsons ID",A multigrid method for the generalized symmetric eigenvalue problem. I. Algorithm and implementation,1992
Journal Article,"Dongarra JJ,Van de Geijn R",Reduction to condensed form for the eigenvalue problem on distributed memory architectures,1992
Journal Article,"Kim SK,Chronopoulos AT",An efficient nonsymmetric Lanczos method on parallel vector computers,1992
Journal Article,Knizhnerman L,Error estimates for the Arnoldi method: the normal matrix case,1992
Journal Article,Kregzhde AV,A numerical method for calculating the eigenvalues of a tridiagonal symmetric matrix,1992
Journal Article,Zhang ZY,A basic parallel iterative method for solving symmetric tridiagonal extremal eigenpair problem,1992
Journal Article,Wright K,Differential equations for the analytic singular value decomposition of a matrix,1992
Journal Article,"Demmel J,Veselic K",Jacobi's method is more accurate than $QR$,1992
Journal Article,Friedland S,Inverse eigenvalue problems for symmetric Toeplitz matrices,1992
Journal Article,"Kuczynski J,Wozniakowski H",Estimating the largest eigenvalue by the power and Lanczos algorithms with a random start,1992
Journal Article,Ji X,A two-dimensional bisection method for solving two-parameter eigenvalue problems,1992
Journal Article,"Moonen M,Van Dooren P,Vandewalle J",A singular value decomposition updating algorithm for subspace tracking,1992
Journal Article,Parlett B,The rewards for maintaining semi-orthogonality among Lanczos vectors,1992
Journal Article,Malyshev A,Guaranteed accuracy in spectral problems of linear algebra. II,1992
Journal Article,"Wang JS,Chang XW",The best approximation of symmetric positive semidefinite matrices with spectral constraints,1992
Journal Article,Jiang YC,A method of finding eigenpairs by the Lanczos process after Rayleigh quotient iteration,1992
Journal Article,"Chan RH,Jin X",A family of block preconditioners for block systems,1992
Book,Saad Y,Numerical methods for large eigenvalue problems,1992
Journal Article,Li L,Necessary and sufficient conditions for solvability of the multiplicative inverse matrix eigenvalue problem,1992
Journal Article,Trefethen LN,Pseudospectra of matrices,1992
Journal Article,"Dongarra JJ,Sidani M",A parallel algorithm for the nonsymmetric eigenvalue problem,1992
Journal Article,"Auslander L,Tsao A",On parallelizable eigensolvers,1992
Journal Article,Morgan R,Generalizations of Davidson's method for computing eigenvalues of large nonsymmetric matrices,1992
Journal Article,"Leung AY,Liu YF",A generalized complex symmetric eigensolver,1992
Journal Article,"Quarteroni A,Zampieri E",Finite element preconditioning for Legendre spectral collocation approximations to elliptic equations and systems,1992
Journal Article,"Chan RH,Yeung MC",Jackson's theorem and circulant preconditioned Toeplitz systems,1992
Journal Article,Chu MT,Matrix differential equations: a continuous realization process for linear algebra problems,1992
Journal Article,"Killingbeck JP,Jolicard G",The folding algorithm for pentadiagonal matrices,1992
Journal Article,Petiton S,Parallel subspace method for non-Hermitian eigenproblems on the connection machine (CM2),1992
Journal Article,Nakamura Y,Erratum: ``A new nonlinear dynamical system that leads to eigenvalues'',1992
Journal Article,Zha H,A two-way chasing scheme for reducing a symmetric arrowhead matrix to tridiagonal form,1992
Journal Article,"Muthiyalu N,Usha S",Eigenvalues of centrosymmetric matrices,1992
Journal Article,"Ammar GS,Gragg W,Reichel L",Downdating of Szego polynomials and data-fitting applications,1992
Journal Article,"Chan RH,Jin X",Skew-circulant preconditioners for skew-Hermitian type Toeplitz systems,1992
Journal Article,Baker G,Accelerated bisection techniques for tri- and quindiagonal matrices,1992
Journal Article,Joubert W,Lanczos methods for the solution of nonsymmetric systems of linear equations,1992
Journal Article,Axelsson O,Bounds of eigenvalues of preconditioned matrices,1992
Journal Article,Suzuki T,Inverse iteration method with a complex parameter,1992
Journal Article,Sun JG,On the sensitivity of semisimple multiple eigenvalues,1992
Journal Article,Lindsay KA,The application of compound matrices to convection problems in multi-layered continua,1992
Journal Article,"Ku T,Kuo CC",On the spectrum of a family of preconditioned block Toeplitz matrices,1992
Journal Article,"Reddy SC,Trefethen LN",Stability of the method of lines,1992
Journal Article,"Burke JV,Overton ML",Stable perturbations of nonsymmetric matrices,1992
Journal Article,Jiang EX,A note on the double-shift $QL$ algorithm,1992
Journal Article,Ikramov KD,Block symmetries in spectral problems for matrix pencils,1992
Journal Article,Magolu MM,Lower eigenvalue bounds for singular pencils of matrices,1992
Journal Article,Lei GY,On the approximate computation of extreme eigenvalues and the condition number of nonsingular matrices,1992
Journal Article,Chu MT,Numerical methods for inverse singular value problems,1992
Journal Article,Lutoborski A,On the convergence of the Euler-Jacobi method,1992
Journal Article,Kuhnert F,Zur numerischen Berechnung benachbarter Matrizeneigenwerte bei Rang-$1$-Stoerung,1992
Journal Article,"Bini DA,Pan V",Practical improvement of the divide-and-conquer eigenvalue algorithms,1992
Journal Article,Huckle T,Circulant/skewcirculant matrices as preconditioners for Hermitian Toeplitz systems,1992
Journal Article,Notay Y,Upper eigenvalue bounds and related modified incomplete factorization strategies,1992
Journal Article,Rusch JJ,Using a complex version of GMRES for solving optical scattering problems,1992
Journal Article,Znojil M,Acceleration of convergence of the Hill-determinant calculations,1992
