Item type,Authors,Title,Date published
Journal Article,"Barlow JL,Parlett B,Veselic K",Preface [Special issue on accurate solutions of eigenvalue problems],2006
Journal Article,"Kleibergen F,Paap R",Generalized reduced rank tests using the singular value decomposition,2006
Journal Article,Jia Z,Using cross-product matrices to compute the SVD,2006
Journal Article,"Cvetkovic L,Kostic V",Between Gersgorin and minimal Gersgorin sets,2006
Journal Article,"Alidema RI,Filippov AF",Estimates for the eigenvalues of matrices,2006
Journal Article,"Gansterer WN,Kreuzer W,Lischka H",Data reduction schemes in Davidson subspace diagonalization for MR-CI,2006
Journal Article,"Shahzadeh-Fazeli SA,Emad N,Dongarra JJ",Eigenvalue computation with NetSolve global computing system,2006
Journal Article,"Sakurai T,Kodaki Y,Umeda H,Inadomi Y,Watanabe T,Nagashima U",A hybrid parallel method for large sparse eigenvalue problems on a grid computing environment using Ninf-G/MPI,2006
Journal Article,"Naono K,Imamura T",An evaluation towards automatically tuned eigensolvers,2006
Journal Article,Erbay H,An efficient algorithm for rank and subspace tracking,2006
Journal Article,Abdel-Aziz MR,Computing eigenpairs of quadratic eigensystems,2006
Journal Article,Rahman S,A solution of the random eigenvalue problem by a dimensional decomposition method,2006
Journal Article,"Chaitin-Chatelin F,Van Gijzen MB",Analysis of parameterized quadratic eigenvalue problems in computational acoustics with homotopic deviation theory,2006
Journal Article,"Grammont L,Largillier A",Krylov method revisited with an application to the localization of eigenvalues,2006
Journal Article,"Xie HQ,Dai H",Sensitivity of multiple eigenvalues of quadratic eigenvalue problems dependent on several parameters,2006
Journal Article,"Pini G,Gambolati G",3-D nested eigenanalysis on finite element grids,2006
Journal Article,"Holmgren S,Serra-Capizzano S,Sundqvist P",Can one hear the composition of a drum?,2006
Journal Article,"Berns-Mueller J,Graham IG,Spence A",Inexact inverse iteration for symmetric matrices,2006
Journal Article,Wu G,A dynamic thick restarted semi-refined ABLE algorithm for computing a few selected eigentriplets of large nonsymmetric matrices,2006
Journal Article,"Vandebril R,Van Camp E,Van Barel M,Mastronardi N",On the convergence properties of the orthogonal similarity transformations to tridiagonal and semiseparable (plus diagonal) form,2006
Journal Article,"Liu XG,Niu QH",A note on the backward error analysis for eigenvalue problems,2006
Journal Article,"Fu H,Ng M,Barlow JL",Structured total least squares for color image restoration,2006
Journal Article,"Schenk O,Bollhoefer M,Roemer RA",On large-scale diagonalization techniques for the Anderson model of localization,2006
Journal Article,"Andrew RA,Miller HG,Plastino A",On the absence of spurious eigenstates in an iterative algorithm proposed by Waxman,2006
Journal Article,"Guarracino MR,Perla F,Zanetti P",A parallel block Lanczos algorithm and its implementation for the evaluation of some eigenvalues of large sparse symmetric matrices on multicomputers,2006
Journal Article,"Hechme G,Nechepurenko YM",Computing reducing subspaces of a large linear matrix pencil,2006
Journal Article,"Viamonte AJ,Ralha R",High relative precision of eigenvalues calculated with Jacobi methods,2006
Journal Article,"Imamura T,Yamada S,Machida M",Over 10 TFLOPS computation for a huge sparse eigensolver on the Earth Simulator,
Journal Article,"Srisutapan J,Bunditsaovapak S",Non-stationary components fixing Jacobi iteration,2006
Journal Article,"Zhang ZY,Zhang HS",Calculation of eigenvalue and eigenvector derivatives of a defective matrix,2006
Journal Article,Mailybaev AA,Computation of multiple eigenvalues and generalized eigenvectors for matrices dependent on parameters,2006
Journal Article,"Misrikhanov MS,Ryabchenko VN",A quadratic eigenvalue problem in electrical power systems,2006
Journal Article,Rommes J,Reduced order models for eigenvalue problems,2006
Journal Article,"Tjahyadi R,Liu W,Venkatesh S",Automatic parameters selection for eigenfaces,2006
Journal Article,"Ahlander K,Munthe-Kaas H",Eigenvalues for equivariant matrices,2006
Journal Article,"Lue LF,Dai H",Refining-strategy of block Davidson method for solving large sparse eigenproblems,2006
Journal Article,"Bergamaschi L,Martinez A,Pini G",Parallel preconditioned conjugate gradient optimization of the Rayleigh quotient for the solution of sparse eigenproblems,2006
Journal Article,"Al Sayed Ali M,Sadkane M",On a Lyapunov type equation related to parabolic spectral dichotomy,2006
Journal Article,,"Erratum: ``On the straightness of eigenvalue interactions'' [Comput. Mech. Online First, 2005] by R. Lawther",2006
Journal Article,Kressner D,A periodic Krylov-Schur algorithm for large matrix products,2006
Journal Article,"Axelsson O,Neytcheva M",Eigenvalue estimates for preconditioned saddle point matrices,2006
Journal Article,"Najafi HS,Ghazvini H",Weighted restarting method in the weighted Arnoldi algorithm for computing the eigenvalues of a nonsymmetric matrix,2006
Journal Article,Kuijlaars AB,Convergence analysis of Krylov subspace iterations with methods from potential theory,2006
Journal Article,"Chu D,Chu MT",Low rank update of singular values,2006
Journal Article,Todor RA,Robust eigenvalue computation for smoothing operators,2006
Journal Article,"Granat R,Kagstroem B",Direct eigenvalue reordering in a product of matrices in periodic Schur form,2006
Journal Article,"Lemonnier D,Van Dooren P",Balancing regular matrix pencils,2006
Journal Article,"Bora S,Mehrmann V",Linear perturbation theory for structured matrix pencils arising in control theory,2006
Journal Article,Stewart M,An error analysis of a unitary Hessenberg $QR$ algorithm,2006
Journal Article,Graillat S,A note on structured pseudospectra,2006
Journal Article,Feng XZ,Iterative approximation of fixed points for almost asymptotically nonexpansive type mappings with random errors,2006
Journal Article,"Chu D,Chu MT",Reachable matrices by a $QR$ step with shift,2006
Journal Article,Solovev SI,Preconditioned iterative methods for a class of nonlinear eigenvalue problems,2006
Journal Article,Ovtchinnikov E,Cluster robust error estimates for the Rayleigh-Ritz approximation. II. Estimates for eigenvalues,2006
Journal Article,Ovtchinnikov E,Cluster robust error estimates for the Rayleigh-Ritz approximation. I. Estimates for invariant subspaces,2006
Journal Article,Ovtchinnikov E,Cluster robustness of preconditioned gradient subspace iteration eigensolvers,2006
Journal Article,Neymeyr K,A geometric theory for preconditioned inverse iteration. IV. On the fastest convergence cases,2006
Journal Article,"Morgan R,Zeng ML",A harmonic restarted Arnoldi algorithm for calculating eigenvalues and determining multiplicity,2006
Journal Article,"Knyazev A,Argentati ME",On proximity of Rayleigh quotients for different vectors and Ritz values generated by different trial subspaces,2006
Journal Article,"Hoffnung L,Li RC,Ye Q",Krylov type subspace methods for matrix polynomials,2006
Journal Article,"Chen CX,Liu XG",Backward errors for two kinds of doubly structured matrix eigenvalue problems,2006
Journal Article,"Jie Q,Liu D",An alternative implementation of the Lanczos algorithm for wavefunction propagation,2006
Journal Article,"Vandebril R,Van Camp E,Van Barel M,Mastronardi N",Orthogonal similarity transformation of a symmetric matrix into a diagonal-plus-semiseparable one with free choice of the diagonal,2006
Journal Article,Ovtchinnikov E,Sharp convergence estimates for the preconditioned steepest descent method for Hermitian eigenvalue problems,2006
Journal Article,"Giraud L,Gratton S",On the sensitivity of some spectral preconditioners,2006
Journal Article,"Mastronardi N,Van Barel M,Van Camp E,Vandebril R",On computing the eigenvectors of a class of structured matrices,2006
Journal Article,"Absil PA,Baker CG,Gallivan K",A truncated-CG style method for symmetric generalized eigenvalue problems,2006
Journal Article,"Delvaux S,Van Barel M",Rank structures preserved by the $QR$-algorithm: the singular case,2006
Journal Article,"Oksa G,Vajtersic M",Efficient pre-processing in the parallel block-Jacobi SVD algorithm,2006
Journal Article,"Arbenz P,Becka M,Geus R,Hetmaniuk U,Mengotti T",On a parallel multilevel preconditioned Maxwell eigensolver,2006
Journal Article,Ye Q,An iterated shift-and-invert Arnoldi algorithm for quadratic matrix eigenvalue problems,2006
Journal Article,"Wang B,Su Y,Bai Z",The second-order biorthogonalization procedure and its application to quadratic eigenvalue problems,2006
Journal Article,"Chen SH,Zhang XM,Chen YD",Interval eigenvalues of closed-loop systems of uncertain structures,2006
Journal Article,Rump SM,"Eigenvalues, pseudospectrum and structured perturbations",2006
Journal Article,"Ahues M,D'Almeida F,Largillier A,Vasconcelos PB",Spectral refinement for clustered eigenvalues of quasi-diagonal matrices,2006
Journal Article,Melman A,Computation of the Newton step for the even and odd characteristic polynomials of a symmetric positive definite Toeplitz matrix,2006
Journal Article,"Flores-Becerra G,Garcia VM,Vidal AM",Parallelization and comparison of local convergent algorithms for solving the inverse additive singular value problem,2006
Journal Article,Kolev LV,Outer interval solution of the eigenvalue problem under general form parametric dependencies,2006
Journal Article,"Delvaux S,Van Barel M",Structures preserved by the QR-algorithm,2006
Journal Article,"Erbay H,Barlow JL",An alternative algorithm for a sliding window ULV decomposition,2006
Journal Article,"Noschese S,Pasquini L",Eigenvalue condition numbers: zero-structured versus traditional,2006
Journal Article,"Bergamaschi L,Pini G,Sartoretto F",Parallel eigenanalysis of multiaquifer systems,2005
Journal Article,"Bai Z,Meerbergen K,Su Y",Arnoldi methods for structure-preserving dimension reduction of second-order dynamical systems,2005
Journal Article,"Cheng SW,Wang Y,Wu Z",Provable dimension detection using principal component analysi,
Journal Article,"Miyajima S,Ogita T,Oishi S",Fast verification for respective eigenvalues of symmetric matrix,2005
Journal Article,Pan V,Can the TPRI structure help us to solve the algebraic eigenproblem?,
Journal Article,"Howell G,Diaa N",Algorithm 841: BHESS: Gaussian reduction to a similar banded Hessenberg form,2005
Journal Article,"Hovinen B,Eberly W",A reliable block Lanczos algorithm over small finite field,
Journal Article,"Hernandez V,Roman JE,Vidal V",SLEPc: a scalable and flexible toolkit for the solution of eigenvalue problems,2005
Journal Article,"Money JH,Ye Q",Algorithm 845: EIGIFP: a MATLAB program for solving large symmetric generalized eigenvalue problems,2005
Journal Article,"Tian X,Dai H",A generalized inverse eigenvalue problem for Jacobi matrices,2005
Journal Article,"Yazici A,Karamancioglu A,Gasimov RN",A nonlinear programming technique to compute the real structured singular value,2005
Journal Article,"Chen GZ,Lin J",The harmonic Arnoldi method for solving the interior multiple eigenproblems,2005
Journal Article,McCartin BJ,Pseudoinverse formulation of Rayleigh-Schroedinger perturbation theory for the symmetric definite generalized eigenvalue problem,2005
Journal Article,Sundar S,A recursive packed algorithm for Cholesky factorization of tridiagonal and pentadiagonal matrix,2005
Journal Article,"Xu YL,Li Z",Computing bound of quadratic self-adjoint matrix polynomial's eigenvalues,2005
Journal Article,Wuelling W,On stabilization and convergence of clustered Ritz values in the Lanczos method,2005
Journal Article,"Dhillon I,Parlett B,Voemel C",Glued matrices and the MRRR algorithm,2005
Journal Article,"Bekas C,Saad Y",Computation of smallest eigenvalues using spectral Schur complements,2005
Journal Article,"Emad N,Petiton S,Edjlali G",Multiple explicitly restarted Arnoldi method for solving large eigenproblems,2005
Journal Article,"Bientinesi P,Dhillon I,Van de Geijn R",A parallel eigensolver for dense symmetric matrices based on multiple relatively robust representations,2005
Journal Article,"Baglama J,Reichel L",Augmented implicitly restarted Lanczos bidiagonalization methods,2005
Journal Article,"Yang C,Gao W,Bai Z,Li XS,Lee LQ,Husbands P,Ng E",An algebraic substructuring method for large-scale eigenvalue calculation,2005
Journal Article,Hochstenbach ME,Generalizations of harmonic and refined Rayleigh-Ritz,2005
Journal Article,"Bini DA,Gemignani L,Pan V",Fast and stable QR eigenvalue algorithms for generalized companion matrices and secular equations,2005
Journal Article,"Mastronardi N,Schuermans M,Van Barel M,Vandebril R,Van Huffel S",A Lanczos-like reduction of symmetric structured matrices to semiseparable form,2005
Journal Article,Gemignani L,Quasiseparable structures of companion pencils under the QZ-algorithm,2005
Journal Article,"Jimenez S,Vazquez L",A dynamics approach to the computation of eigenvectors of matrices,2005
Journal Article,Li W,Some new perturbation bounds for subunitary polar factors,2005
Journal Article,"Fujii Y,Kakihara M,Aoyagi M,Fujino S",An application of projection method for generalized eigenvalue problems using preconditioned COCG method,2005
Journal Article,"Killingbeck JP,Grosjean A,Jolicard G",A complex variable form of the HEG technique,2005
Journal Article,"Chen GZ,Lin J",The harmonic Ritz values of $A$ subspace spanned by refined harmonic Ritz vectors,2005
Journal Article,Gu G,Restarted GMRES augmented with harmonic Ritz vectors for shifted linear systems,2005
Journal Article,"Wagenknecht T,Agarwal J",Structured pseudospectra in structural engineering,2005
Journal Article,"Dieci L,Gasparo MG,Papini A",Continuation of singular value decompositions,2005
Journal Article,McCartin BJ,Pseudoinverse formulation of analytic Rayleigh-Schroedinger perturbation theory for the symmetric eigenvalue problem,2005
Journal Article,"Jarlebring E,Voss H","Rational Krylov for nonlinear eigenproblems, an iterative projection method",2005
Journal Article,"Ammar GS,Gragg W,He C",An efficient QR algorithm for a Hessenberg submatrix of a unitary matrix,2005
Journal Article,"Beattie CA,Embree M,Sorensen DC",Convergence of polynomial restart Krylov methods for eigenvalue computations,2005
Journal Article,Xu H,A numerical method for computing an SVD-like decomposition,2005
Journal Article,Parlett B,A bidiagonal matrix determines its hyperbolic SVD to varied relative accuracy,2005
Journal Article,"Londre T,Rhee NH",Numerical stability of the parallel Jacobi method,2005
Journal Article,Kressner D,Perturbation bounds for isotropic invariant subspaces of skew-Hamiltonian matrices,2005
Journal Article,Simoncini V,Variable accuracy of matrix-vector products in projection methods for eigencomputation,2005
Journal Article,"Van Barel M,Vandebril R,Mastronardi N",An orthogonal similarity reduction of a matrix into semiseparable form,2005
Journal Article,"Bini DA,Gemignani L,Tisseur F",The Ehrlich-Aberth method for the nonsymmetric tridiagonal eigenvalue problem,2005
Journal Article,"Lancaster P,Psarrakos P",On the pseudospectra of matrix polynomials,2005
Journal Article,Koev P,Accurate eigenvalues and SVDs of totally nonnegative matrices,2005
Journal Article,Wuelling W,The stabilization of weights in the Lanczos and conjugate gradient method,2005
Journal Article,"Salimbahrami B,Lohmann B,Bechtold T,Korvink JG",A two-sided Arnoldi algorithm with stopping criterion and MIMO selection procedure,2005
Journal Article,Fasino D,Rational Krylov matrices and QR steps on Hermitian diagonal-plus-semiseparable matrices,2005
Journal Article,"Mengi E,Overton ML",Algorithms for the computation of the pseudospectral radius and the numerical radius of a matrix,2005
Journal Article,"Ouyang S,Hua Y",Bi-iterative least-square method for subspace tracking,2005
Journal Article,Pester C,Hamiltonian eigenvalue symmetry for quadratic operator eigenvalue problems,2005
Journal Article,"Guarracino MR,Perla F,Zanetti P",A parallel computational kernel for sparse nonsymmetric eigenvalue problems on multicomputers,2005
Journal Article,"Chang XW,Gander MJ,Karaa S",Asymptotic properties of the $QR$ factorization of banded Hessenberg-Toeplitz matrices,2005
Journal Article,"Vandebril R,Van Barel M,Mastronardi N",An implicit $QR$ algorithm for symmetric semiseparable matrices,2005
Journal Article,"Hwang TM,Lin WW,Liu JL,Wang W",Jacobi-Davidson methods for cubic eigenvalue problems,2005
Journal Article,"Huang H,Tam TY",On the $QR$ iterations of real matrices,2005
Book,Kressner D,Numerical methods for general and structured eigenvalue problems,2005
Journal Article,"Li RC,Bai Z",Structure-preserving model reduction using a Krylov subspace projection formulation,2005
Journal Article,"Jia Z,Feng S",A refined Jacobi-Davidson method and its correction equation,2005
Journal Article,"Liu YG,You ZS,Cao LP,Jiang XR",A neural network algorithm for computing matrix eigenvalues and eigenvectors,2005
Journal Article,"Malyshev A,Sadkane M",Perturbation theory with respect to the first approximation for the symmetric Lanczos algorithm,2005
Journal Article,Hari V,Accelerating the SVD block-Jacobi method,2005
Journal Article,"Fierro RD,Hansen PC",UTV expansion pack: Special-purpose rank-revealing algorithms,2005
Journal Article,"Lin XL,Jiang YL",$QR$ decomposition and algorithm for unitary symmetric matrix,2005
Journal Article,"Li Z,Shao XH,Li CJ",Eigenvalue estimation and preconditioning for the matrix $B^TA^-1B$,2005
Journal Article,Sukhinin MF,On the computation of the eigenvalues of a symmetric matrix,2005
Journal Article,"Singer S,Singer S",Skew-symmetric differential qd algorithm,2005
Journal Article,Ngo KV,An approach of eigenvalue perturbation theory,2005
Journal Article,Gemignani L,A unitary Hessenberg $QR$-based algorithm via semiseparable matrices,2005
Journal Article,Kozhan RV,Asymptotics of the eigenvalues of two-diagonal Jacobi matrices,2005
Journal Article,Chkhartishvili LS,An iterative solution of the secular equation,2005
Journal Article,"Harris PJ,Wang H,Chakrabarti R,Henwood D",Stability analysis of a collocation method for solving the retarded potential integral equation,2005
Journal Article,Abdel-Aziz MR,Bounds for relative distances of eigenvalues in free vibration analysis,2005
Journal Article,"Hou W,Jiang EX",A stability analysis of the $(k)$ Jacobi matrix inverse eigenvalue problem,2005
Journal Article,Falk S,Der Eigenwertalgorithmus ECP fuer Polynommatrizen,2005
Journal Article,Jiang EX,Perturbation in eigenvalues of a symmetric tridiagonal matrix,2005
Journal Article,"Eidelman Y,Gohberg I,Olshevsky V",The QR iteration method for Hermitian quasiseparable matrices of an arbitrary order,2005
Journal Article,"Janovska D,Opfer G",Fast Givens transformation for quaternion valued matrices applied to Hessenberg reductions,2005
Journal Article,Kressner D,On the use of larger bulges in the QR algorithm,2005
Journal Article,"Mackey DS,Mackey N,Dunlavy DM",Structure preserving algorithms for perplectic eigenproblems,2005
Journal Article,"Larin M,Ilin V",Variable-step preconditioned conjugate gradient method for partial symmetric eigenvalue problems,2005
Journal Article,Karaa S,A limit result concerning the $QR$ factorization of banded Toeplitz matrices,2005
Journal Article,"Eidelman Y,Gohberg I,Olshevsky V",Eigenstructure of order-one-quasiseparable matrices. Three-term and two-term recurrence relations,2005
Journal Article,Matsekh AM,The Godunov-inverse iteration: a fast and accurate solution to the symmetric tridiagonal eigenvalue problem,2005
Journal Article,"Arbenz P,Geus R",Multilevel preconditioned iterative eigensolvers for Maxwell eigenvalue problems,2005
Journal Article,Watkins D,Product eigenvalue problems,2005
Journal Article,"Kaveh A,Sayarinejad MA",Eigenvalues of factorable matrices with form IV symmetry,2005
Journal Article,"Delyon F,Duneau M",Computation of eigenmodes of photonic crystals by inversion of the Maxwell operator,2005
Journal Article,"Li K,Uvah J,Zhao S",A fully parallel method for the singular eigenvalue problem,2005
Journal Article,"Fierro RD,Jiang EP",Lanczos and the Riemannian SVD in information retrieval applications,2005
Journal Article,"Liesen J,Saylor PE",Orthogonal Hessenberg reduction and orthogonal Krylov subspace bases,2005
Journal Article,"Chen GZ,Jia Z",A refined harmonic Rayleigh-Ritz procedure and an explicitly restarted refined harmonic Arnoldi algorithm,2005
Journal Article,"Liu XG,Wang ZX",A note on the backward errors for Hermite eigenvalue problems,2005
Journal Article,"Li S,Zhou G,Chen D",The WZ algorithm for the eigenvalue problem of complex matrix,2005
Journal Article,"Sidje RB,Burrage K",QRT: a QR-based tridiagonalization algorithm for nonsymmetric matrices,2005
Journal Article,"Alam R,Bora S",On stable eigendecompositions of matrices,2005
Journal Article,"Helsen S,Kuijlaars AB,Van Barel M",Convergence of the isometric Arnoldi process,2005
Journal Article,"Bouras A,Fraysse V",Inexact matrix-vector products in Krylov methods for solving linear systems: a relaxation strategy,2005
Journal Article,"Bai Z,Su Y",SOAR: a second-order Arnoldi method for the solution of the quadratic eigenvalue problem,2005
Journal Article,"Grosser B,Lang B",On symmetric eigenproblems induced by the bidiagonal SVD,2005
Journal Article,"Kaya D,Wright K",Parallel algorithms for reduction of a general matrix to upper Hessenberg form on a shared memory multiprocessor,2005
Journal Article,Jia Z,"The convergence of harmonic Ritz values, harmonic Ritz vectors, and refined harmonic Ritz vectors",2005
Journal Article,"Mastronardi N,Van Camp E,Van Barel M",Divide and conquer algorithms for computing the eigendecomposition of symmetric diagonal-plus-semiseparable matrices,2005
Journal Article,"Ahues M,Largillier A,D'Almeida F,Vasconcelos PB",Spectral refinement on quasi-diagonal matrices,2005
Journal Article,"Bosner N,Drmac Z",On accuracy properties of one-sided bidiagonalization algorithm and its applications,
Journal Article,"Qiu Z,Wang X,Friswell MI",Eigenvalue bounds of structures with uncertain-but-bounded parameters,2005
Journal Article,"Palmer AS,Phillips TN",Numerical approximation of the spectra of Phan-Thien Tanner liquids,2005
Journal Article,"Brezinski C,Redivo-Zaglia M,Serra-Capizzano S",Extrapolation methods for PageRank computations,2005
Journal Article,"Huckaby DA,Chan TF",Stewart's pivoted QLP decomposition for low-rank matrices,2005
Journal Article,"Li W,Sun W",The perturbation bounds for eigenvalues of normal matrices,2005
Journal Article,"Feng S,Jia Z",A refined Jacobi-Davidson method and its correction equation,2005
Journal Article,Sun JG,Perturbation bounds for subspaces associated with periodic eigenproblems,2005
Journal Article,"Yeung MC,Boley DL",Transpose-free multiple Lanczos and its application in Pade approximation,2005
Journal Article,Pang MX,New estimates for singular values of a matrix,2005
Journal Article,Kaya D,The symmetric tridiagonal eigenproblem on a shared memory multiprocessor. II,2005
Journal Article,Neymeyr K,A note on inverse iteration,2005
Journal Article,"Shen Y,Zhao J,Fan H",Properties and computations of matrix pseudospectra,2005
Journal Article,"Alam R,Bora S",On sensitivity of eigenvalues and eigendecompositions of matrices,2005
Journal Article,"Kostic A,Voss H",Recurrence relations for the even and odd characteristic polynomials of a symmetric Toeplitz matrix,2005
Journal Article,"Jonsson GF,Vavasis SA",Accurate solution of polynomial equations using Macaulay resultant matrices,2005
Journal Article,"Balk I,Zorin S",MPI-based parallelized model order reduction algorithm,2004
Journal Article,Politi T,A continuous approach for the computation of the hyperbolic singular value decomposition,2004
Journal Article,"Sima DM,Van Huffel S,Golub G",Regularized total least squares based on quadratic eigenvalue problem solvers,2004
Journal Article,Hochstenbach ME,"Harmonic and refined extraction methods for the singular value problem, with applications in least squares problems",2004
Journal Article,"Fiori S,Del Buono N,Politi T",Optical flow estimation via neural singular value decomposition learning,2004
Journal Article,"Diele F,Mastronardi N,Van Barel M,Van Camp E",On computing the spectral decomposition of symmetric arrowhead matrices,2004
Journal Article,"Apel T,Mehrmann V,Watkins D",Numerical solution of large scale structured polynomial or rational eigenvalue problems,2004
Journal Article,Abdel-Aziz MR,Relative perturbation theory for matrix eigenproblems in free vibration analysis,2004
Journal Article,"Molchanov IN,Gerasimova TA,Popov AV,Khimich AN,Chistyakova TV",An intelligent system for investigating and solving matrix eigenvalue problems,2004
Journal Article,"Sakurai T,Tadano H,Inadomi Y,Nagashima U",A moment-based method for large-scale generalized eigenvalue problems,2004
Journal Article,Bezerra LH,Computing eigenvalues using Newton-type methods,2004
Journal Article,"Liu XG,Wang XF",Condition numbers for polynomial eigenvalue problems,2004
Journal Article,"Marco A,Martinez JJ",A new source of structured singular value decomposition problems,2004
Journal Article,Nair MT,Eigen-pairs of perturbed matrices,2004
Journal Article,"Jia Z,Sun Y",A refined residual iteration method,2004
Journal Article,"Yan Q,Wei X",The refined biorthogonalization Lanczos algorithm,2004
Journal Article,"Wu G,Feng L",A quasi-refined iterative algorithm based on the Lanczos biorthogonalization procedure for large eigenproblems,2004
Journal Article,"Bini DA,Daddi F,Gemignani L",On the shifted QR iteration applied to companion matrices,2004
Journal Article,Khilenko VV,A numerical method for determining the eigenvalues of matrices of arbitrarily large size,2004
Journal Article,Jiang EX,A new proof of the global convergence for QL method with Wilkinson shift,2004
Journal Article,"Blom K,Ruhe A",A Krylov subspace method for information retrieval,2004-05
