Item type,Authors,Title,Date published
Journal Article,"Abdikalykov AK,Ikramov KD,Chugunov VN",On the eigenvalues of $(T+H)$-circulants and skew $(T+H)$-circulants,2014
Journal Article,"Pfrang CW,Deift P,Menon G",How long does it take to compute the eigenvalues of a random symmetric matrix?,2014
Journal Article,Pazdanowski M,SVD as a preconditioner in nonlinear optimization,2014
Journal Article,"He J,Huang TZ,Cheng GH",Some inequalities for nonnegative tensors,2014
Journal Article,"Wang T,Lv H,Sang H",Estimations for spectral radius of nonnegative matrices and the smallest eigenvalue of $M$-matrices,2014
Journal Article,"He J,Huang TZ",Inequalities for $M$-tensors,2014
Journal Article,"Willert J,Kelley CT,Knoll DA,Park H",A hybrid deterministic/Monte Carlo method for solving the $k$-eigenvalue problem with a comparison to analog Monte Carlo solutions,2014
Journal Article,"Betzler BR,Martin WR,Kiedrowski BC,Brown FB",Calculating $\alpha $ eigenvalues of one-dimensional media with Monte Carlo,2014
Journal Article,Mafteiu-Scai LO,The bandwidths of a matrix. A survey of algorithms,2014
Journal Article,"Malyshev A,Sadkane M,Salam A",A subspace iteration for symplectic matrices,2014
Journal Article,Meurant G,On the location of the Ritz values in the Arnoldi process,2014
Journal Article,"Danisman Y,Yilmaz MF,Ozkaya A,Comlekciler IT",A comparison of eigenvalue methods for principal component analysis,2014
Journal Article,Pan CP,A generalized two-stage iterative method for computing PageRank,2014
Journal Article,"Cao Y,Dai H",Quadratic approximation methods for solving nonlinear eigenvalue problems,2014
Journal Article,"Liang Q,Ye Q",Computing singular values of large matrices with an inverse-free preconditioned Krylov subspace method,2014
Journal Article,"Abdikalykov AK,Ikramov KD,Chugunov VN",Some acceleration techniques for calculating the eigenvalues of normal Toeplitz matrices,2014
Journal Article,"Abdikalykov AK,Ikramov KD,Chugunov VN",On the calculation of eigenvalues for some classes of normal Hankel matrices,2014
Journal Article,"Yamamoto Y,Lan Z,Kudo S",Convergence analysis of the parallel classical block Jacobi method for the symmetric eigenvalue problem,2014
Journal Article,"Guettel S,Van Beeumen R,Meerbergen K,Michiels W",NLEIGS: a class of fully rational Krylov methods for nonlinear eigenvalue problems,2014
Journal Article,"Zhu L,Xu WW",Backward error analysis for an eigenproblem involving two classes of matrices,2014
Journal Article,"Noschese S,Reichel L",A modified truncated singular value decomposition method for discrete ill-posed problems,2014
Journal Article,"Al-Fhaid AS,Serra Capizzano S,Sesana D,Ullah MZ",Singular-value (and eigenvalue) distribution and Krylov preconditioning of sequences of sampling matrices approximating integral operators,2014
Journal Article,"Dmytryshyn A,Kagstroem B",Orbit closure hierarchies of skew-symmetric matrix pencils,2014
Journal Article,"Guglielmi N,Kressner D,Lubich C",Computing extremal points of symplectic pseudospectra and solving symplectic matrix nearness problems,2014
Journal Article,Aishima K,A note on the Rayleigh quotient iteration for symmetric eigenvalue problems,2014
Journal Article,Miyajima S,Verified bounds for all the singular values of matrix,2014
Journal Article,"Zhang LH,Li R","Maximization of the sum of the trace ratio on the Stiefel manifold, I: Theory",2014
Journal Article,"Chung J,Chung M",An efficient approach for computing optimal low-rank regularized inverse matrices,2014
Journal Article,"Friedland S,Ottaviani G",The number of singular vector tuples and uniqueness of best rank-one approximation of tensors,2014
Journal Article,"Constantine PG,Gleich DF,Hou Y,Templeton J",Model reduction with MapReduce-enabled tall and skinny singular value decomposition,2014
Journal Article,"Dailey M,Dopico F,Ye Q",Relative perturbation theory for diagonally dominant matrices,2014
Journal Article,"Zhang J,Li S,Cheng L,Liao X,Cheng G",A fast and stable algorithm for downdating the singular value decomposition,2014
Journal Article,"Yang D,Ma Z,Buja A",A sparse singular value decomposition method for high-dimensional data,2014
Journal Article,"Huang WQ,Gu XD,Lin WW,Yau ST",A novel symmetric skew-Hamiltonian isotropic Lanczos algorithm for spectral conformal parameterizations,2014
Journal Article,"Kressner D,Steinlechner M,Uschmajew A",Low-rank tensor methods with subspace correction for symmetric eigenvalue problems,2014
Journal Article,"Li W,Ng M",The perturbation bound for the spectral radius of a nonnegative tensor,2014
Journal Article,"Neymeyr K,Zhou M",Iterative minimization of the Rayleigh quotient by block steepest descent iterations,2014
Journal Article,"Joubert SV,Shatalov MY,Fay TH",On numerically solving an eigenvalue problem arising in a resonator gyroscope,2014
Journal Article,"Adlerborn B,Kagstroem B,Kressner D",A parallel QZ algorithm for distributed memory HPC systems,2014
Journal Article,"Bueno MI,Furtado S",Structured strong linearizations from Fiedler pencils with repetition II,2014
Journal Article,"Donatelli M,Garoni C,Mazza M,Serra-Capizzano S,Sesana D",Spectral behavior of preconditioned non-Hermitian multilevel block Toeplitz matrices with matrix-valued symbol,2014
Journal Article,Chen H,A splitting preconditioner for the iterative solution of implicit Runge-Kutta and boundary value methods,2014
Journal Article,Miyajima S,Fast enclosure for all eigenvalues and invariant subspaces in generalized eigenvalue problems,2014
Journal Article,"Kanaksabee P,Dookhitram K,Bhuruth M",Krylov subspace method for fuzzy eigenvalue problem,2014
Journal Article,"Fermo L,Van der Mee C,Seatzu S",Parameter estimation of monomial-exponential sums,2014
Journal Article,Strauss M,A new approach to spectral approximation,2014
Journal Article,"Ferranti M,Le TH,Vandebril R",A comparison between the complex symmetric based and classical computation of the singular value decomposition of normal matrices,2014
Journal Article,"Fathi-Vajargah B,Jahanbin A",A way for low ranking matrices and its stochastic computations using Monte Carlo method,2014
Journal Article,"Liu H,Song Z",An inexact continuation accelerated proximal gradient algorithm for low $n$-rank tensor recovery,2014
Journal Article,"Psarrakos P,Tsatsomeros MJ",On the geometry of the envelope of a matrix,2014
Journal Article,"Li C,Li YT",A modification of eigenvalue localization for stochastic matrices,2014
Journal Article,"Bueno MI,Curlett K,Furtado S",Structured strong linearizations from Fiedler pencils with repetition I,2014
Journal Article,"Yin JF,Yin G",Restarted full orthogonalization method with deflation for shifted linear systems,2014
Journal Article,"Jarlebring E,Kvaal S,Michiels W",An inverse iteration method for eigenvalue problems with eigenvector nonlinearities,2014
Journal Article,"Vecharynski E,Saad Y",Fast updating algorithms for latent semantic indexing,2014
Journal Article,"De Teran F,Dopico F,Mackey DS",Spectral equivalence of matrix polynomials and the index sum theorem,2014
Journal Article,"Grubisic L,Truhar N,Miodragovic S",The rotation of eigenspaces of perturbed matrix pairs II,2014
Journal Article,"Li S,Gu M,Cheng L,Chi XB,Sun M",An accelerated divide-and-conquer algorithm for the bidiagonal SVD problem,2014
Journal Article,"Bonnaillie-Noel V,Lena C",Spectral minimal partitions of a sector,2014
Journal Article,Cheng GH,Convergence analysis of ARD algorithm,2014
Journal Article,"Osting B,White CD,Oudet E",Minimal Dirichlet energy partitions for graphs,2014
Journal Article,"Kressner D,Miloloza Pandur M,Shao M",An indefinite variant of LOBPCG for definite matrix pencils,2014
Journal Article,Pena JM,Eigenvalue localization and Neville elimination,2014
Journal Article,"Wang P,Dai H",Sensitivity of defective multiple eigenvalues of a quadratic matrix polynomial problem,2014
Journal Article,"Liu W,Dai H",Implicitly restarted and refined global Lanczos method,2014
Journal Article,"Akinola RO,Spence A",A comparison of the implicit determinant method and inverse iteration,2014
Journal Article,"Huang TM,Lin WW",A novel deflation technique for solving quadratic eigenvalue problems,2014
Journal Article,"Kressner D,Roman JE",Memory-efficient Arnoldi algorithms for linearizations of matrix polynomials in Chebyshev basis,2014
Journal Article,"Akinola RO,Freitag MA,Spence A",The computation of Jordan blocks in parameter-dependent matrices,2014
Journal Article,"Szyld DB,Xue F",Several properties of invariant pairs of nonlinear algebraic eigenvalue problems,2014
Journal Article,"Xi Y,Xia J,Chan RH",A fast randomized eigensolver with structured LDL factorization update,2014
Journal Article,"Pu BY,Huang TZ,Wen C",A preconditioned and extrapolation-accelerated GMRES method for PageRank,2014
Journal Article,"Berljafa M,Di Napoli E",A parellel and scalable iterative solver for sequences of dense eigenproblems arising in FLAPW,2014
Journal Article,"Jia Z,Li C",Inner iterations in the shift-invert residual Arnoldi method and the Jacobi-Davidson method,2014
Journal Article,"Chen X,Li W,Ng M",On condition numbers of the spectral projections associated with periodic eigenproblems,2014
Journal Article,"Huang TM,Hsieh HE,Lin WW,Wang W",Eigenvalue solvers for three dimensional photonic crystals with face-centered cubic lattice,2014
Journal Article,"Butta P,Noschese S",Structured maximal perturbations for Hamiltonian eigenvalue problems,2014
Journal Article,"Brugiapaglia S,Gemignani L",On the simultaneous refinement of the zeros of H-palindromic polynomials,2014
Journal Article,Yeung MC,ML($n$)BiCGStabt: a ML($n$)BiCGStab variant with $\bold A$-transpose,2014
Journal Article,Miao H,Modified block Jacobi-Davidson method for solving large sparse eigenproblems,2014
Journal Article,"Karow M,Kressner D,Mengi E",Nonlinear eigenvalue problems with specified eigenvalues,2014
Journal Article,Cheng GH,Note on some upper bounds for the condition number,2014
Journal Article,"Karlsson L,Kagstroem B,Wadbro E",Fine-grained bulge-chasing kernels for strongly scalable parallel QR algorithms,2014
Journal Article,"Aktulga HM,Lin L,Haine C,Ng E,Yang C",Parallel eigenvalue calculation based on multiple shift-invert Lanczos and contour integral based spectral projection method,2014
Journal Article,"Auckenthaler T,Huckle T,Wittmann R",A blocked QR-decomposition for the parallel symmetric eigenvalue problem,2014
Journal Article,"Sun W,So HC,Chen Y,Huang LT,Huang L",Approximate subspace-based iterative adaptive approach for fast two-dimensional spectral estimation,2014
Journal Article,"Hofstaetter H,Koch O",An approximate eigensolver for self-consistent field calculations,2014
Journal Article,"Li S,Gu M,Parlett B",An improved DQDS algorithm,2014
Journal Article,"Baglama J,Fenu C,Reichel L,Rodriguez G",Analysis of directed networks via partial singular value decomposition and Gauss quadrature,2014
Journal Article,"Freitag MA,Spence A",A new approach for calculating the real stability radius,2014
Journal Article,"Bodendiek A,Bollhoefer M",Adaptive-order rational Arnoldi-type methods in computational electromagnetism,2014
Journal Article,"Kamenski L,Huang W,Xu H",Conditioning of finite element equations with arbitrary anisotropic meshes,2014
Journal Article,"Gangl S,Mongus D,Zalik B",An efficient eigenspace updating scheme for high-dimensional systems,2014
Journal Article,"Sato H,Iwai T",Optimization algorithms on the Grassmann manifold with application to matrix eigenvalue problems,2014
Journal Article,"Kumar GK,Lui SH",On some properties of the pseudospectral radius,2014
Journal Article,"Imamura T,Yamada S,Machida M",Eigen-G: GPU-based eigenvalue solver for real-symmetric dense matrices,2014
Journal Article,"Aliaga JI,Davidovic D,Quintana-Orti ES",Out-of-core solution of eigenproblems for macromolecular simulations,2014
Journal Article,"Becka M,Oksa G",Parallel one-sided Jacobi SVD algorithm with variable blocking factor,2014
Journal Article,"Alperovich A,Druinsky A,Toledo S",Experiences with a Lanczos eigensolver in high-precision arithmetic,2014
Journal Article,"Gutheil I,Muenchhalfen JF,Grotendorst J",Performance of dense eigensolvers on BlueGene/Q,2014
Journal Article,"Zhang LH,Xue J,Li RC",Rayleigh-Ritz approximation for the linear response eigenvalue problem,2014
Journal Article,"Neymeyr K,Zhou M",The block preconditioned steepest descent iteration for elliptic operator eigenvalue problems,2014
Journal Article,"Mengi E,Yildirim EA,Kilic M",Numerical optimization of eigenvalues of Hermitian matrix functions,2014
Journal Article,"Katsouleas G,Maroulas J",Interaction between Hermitian and normal imbeddings,2014
Journal Article,"Li Y,Gu K,Zhou J,Xu S",Estimating stable delay intervals with a discretized Lyapunov-Krasovskii functional formulation,2014
Journal Article,"Li W,Vong SW,Peng X",On eigenvalue perturbation bounds for Hermitian block tridiagonal matrices,2014
Journal Article,"Nagata M,Iwasaki M,Nakamura Y",Accurate similarity transformation derived from the discrete Lotka-Volterra system for bidiagonal singular values,2014
Journal Article,"Ishii H,Tempo R","The PageRank problem, multiagent consensus, and Web aggregation: a systems and control viewpoint",2014
Journal Article,"Edelman A,Koev P",Eigenvalue distributions of beta-Wishart matrices,2014
Journal Article,"Wu G,Zhang L",On expansion of search subspaces for large non-Hermitian eigenproblems,2014
Journal Article,"Baglama J,Richmond DJ",Implicitly restarting the LSQR algorithm,2014
Journal Article,"Bettebghor D,Leroy FH",Overlapping radial basis function interpolants for spectrally accurate approximation of functions of eigenvalues with application to buckling of composite plates,2014
Journal Article,"Wu SJ,Lin MM",Numerical methods for solving nonnegative inverse singular value problems with prescribed structure,2014
Journal Article,"Freitag MA,Spence A,Van Dooren P",Calculating the $H_\infty $-norm using the implicit determinant method,2014
Journal Article,"Akinola RO,Freitag MA,Spence A",The calculation of the distance to a nearby defective matrix,2014
Journal Article,"Vassilevski PS,Zikatanov LT",Commuting projections on graphs,2014
Journal Article,"Guglielmi N,Zennaro M",Stability of linear problems: joint spectral radius of sets of matrices,2014
Journal Article,"Dieci L,Papini A,Pugliese A,Spadoni A",Continuous decompositions and coalescing eigenvalues for matrices depending on parameters,2014
Journal Article,"Barreras A,Pena JM","Matrices with bidiagonal decomposition, accurate computations and corner cutting algorithms",2014
Journal Article,"Wu SL,Li CX",Spectral analysis of some discrete systems arising from Maxwell equations,2014
Journal Article,"Mach T,Vandebril R",On deflations in extended QR algorithms,2014
Journal Article,"Paige C,Panayotov I,Zemke JP",An augmented analysis of the perturbed two-sided Lanczos tridiagonalization process,2014
Journal Article,"Shen SQ,Yu J,Huang TZ",Some classes of nonsingular matrices with applications to localize the real eigenvalues of real matrices,2014
Journal Article,"Van Zee FG,Van de Geijn R,Quintana-Orti G",Restructuring the tridiagonal and bidiagonal QR algorithms for performance,2014
Journal Article,"De Teran F,Dopico F,Perez J",New bounds for roots of polynomials based on Fiedler companion matrices,2014
Journal Article,"Delgado J,Pena JM",Fast and accurate algorithms for Jacobi-Stirling matrices,2014
Journal Article,"Wu JP,Song JQ,Zhang WM",An efficient and accurate method to compute the Fiedler vector based on Householder deflation and inverse power iteration,2014
Journal Article,"Petschow M,Quintana-Orti ES,Bientinesi P",Improved accuracy and parallelism for MRRR-based eigensolvers---a mixed precision approach,2014
Journal Article,Pestana J,On the eigenvalues and eigenvectors of block triangular preconditioned block matrices,2014
Journal Article,"Zeng L,Su Y",A backward stable algorithm for quadratic eigenvalue problems,2014
Journal Article,Uhlig F,Faster and more accurate computation of the field of values boundary for $n$ by $n$ matrices,2014
Journal Article,"Kressner D,Mengi E,Nakic I,Truhar N",Generalized eigenvalue problems with specified eigenvalues,2014
Journal Article,"Bora S,Karow M,Mehl C,Sharma P",Structured eigenvalue backward errors of matrix pencils and polynomials with Hermitian and related structures,2014
Journal Article,"Li Y,Wei M,Zhang F,Zhao J",A fast structure-preserving method for computing the singular value decomposition of quaternion matrices,2014
Journal Article,"Hadjidimos A,Tzoumas MG",On Brauer-Ostrowski and Brualdi sets,2014
Journal Article,"Jarlebring E,Meerbergen K,Michiels W",Computing a partial Schur factorization of nonlinear eigenvalue problems using the infinite Arnoldi method,2014
Journal Article,Chen MX,An augmented Lagrangian dual optimization approach to the $H$-weighted model updating problem,2014
Journal Article,"Jungers RM,Cicone A,Guglielmi N",Lifted polytope methods for computing the joint spectral radius,2014
Journal Article,"Tang PT,Polizzi E",FEAST as a subspace iteration eigensolver accelerated by approximate spectral projection,2014
Journal Article,"Imakura A,Du L,Sakurai T",A block Arnoldi-type contour integral spectral projection method for solving generalized eigenvalue problems,2014
Journal Article,"Romero E,Roman JE",A parallel implementation of Davidson methods for large-scale eigenvalue problems in SLEPc,2014
Journal Article,"Karlsson L,Kressner D,Lang B",Optimally packed chains of bulges in multishift QR algorithms,2014
Journal Article,"Liu L,Huang W,Chen DR",Exact minimum rank approximation via Schatten $p$-norm minimization,2014
Journal Article,"Amodio P,Brugnano L",Recent advances in bibliometric indexes and the \it PaperRank problem,2014
Journal Article,"Wu SL,Li CX",A splitting iterative method for the discrete dynamic linear systems,2014
Journal Article,Leng H,Real eigenvalue bounds of standard and generalized real interval eigenvalue problems,2014
Journal Article,"Jarlebring E,Guettel S",A spatially adaptive iterative method for a class of nonlinear operator eigenproblems,2014
Journal Article,"Kressner D,Vandereycken B",Subspace methods for computing the pseudospectral abscissa and the stability radius,2014
Journal Article,Ibrahim NF,An algorithm for the largest eigenvalue of nonhomogeneous nonnegative polynomials,2014
Journal Article,"Wei Y,Qu Y",Perturbation bound for the eigenvalues of a singular diagonalizable matrix,2014
Journal Article,Armentano D,Complexity of path-following methods for the eigenvalue problem,2014
Journal Article,"Salam A,Al-Aidarous ES",Equivalence between modified symplectic Gram-Schmidt and Householder SR algorithms,2014
Journal Article,"Fan HY,Weng PC,Chu EK",Refining estimates of invariant and deflating subspaces for large and sparse matrices and pencils,2014
Journal Article,"Boito P,Eidelman Y,Gemignani L",Implicit QR for rank-structured matrix pencils,2014
Journal Article,"Bai Z,Li RC",Minimization principles and computation for the generalized linear response eigenvalue problem,2014
Journal Article,"Aurentz JL,Vandebril R,Watkins D","Fast computation of eigenvalues of companion, comrade, and related matrices",2014
Journal Article,"Schulze Darup M,Kastsian M,Mross S,Moennigmann M",Efficient computation of spectral bounds for Hessian matrices on hyperrectangles for global optimization,2014
Journal Article,"Rubensson EH,Niklasson AM",Interior eigenvalues from density matrix expansions in quantum mechanical molecular dynamics,2014
Journal Article,"Bueno MI,De Teran F",Eigenvectors and minimal bases for some families of Fiedler-like linearizations,2014
Journal Article,"Jena L,Mishra D,Pani S",Convergence and comparison theorems for single and double decompositions of rectangular matrices,2014
Journal Article,"Fatoorehchi H,Abolghasemi H",On computation of real eigenvalues of matrices via the Adomian decomposition,2014
Journal Article,"Doukhnitch E,Salamah M,Andreev A",Effective processor architecture for matrix decomposition,2014
Journal Article,"Ravibabu M,Singh A",On refined Ritz vectors and polynomial characterization,2014
Journal Article,"Wu SL,Bergamaschi L,Li CX",A note on eigenvalue distribution of constraint-preconditioned symmetric saddle point matrices [corrigendum to MR2951253],2014
Journal Article,"Cheng GH,Song Z,Yang J,Si J",The bounds of the eigenvalues for rank-one modification of Hermitian matrix,2014
Journal Article,"Hu S,Huang Z,Qi L",Strictly nonnegative tensors and nonnegative tensor partition,2014
Journal Article,"Adhikari B,Alam R",Structured mapping problems for linearly structured matrices,2014
Journal Article,"Hari V,Singer S,Singer S",Full block $J$-Jacobi method for Hermitian matrices,2014
Journal Article,"Antoine X,Duboscq R",Robust and efficient preconditioned Krylov spectral solvers for computing the ground states of fast rotating and strongly interacting Bose-Einstein condensates,2014
Journal Article,"Zhang Z,Chen W,Cheng X",A penalty optimization algorithm for eigenmode optimization problem using sensitivity analysis,2014
Book,"Eidelman Y,Gohberg I,Haimovici I",Separable type representations of matrices and fast algorithms. Vol. 2,2014
Journal Article,"Jiang B,Cui C,Dai YH",Unconstrained optimization models for computing several extreme eigenpairs of real symmetric matrices,2014
Journal Article,"Muhic A,Plestenjak B",A method for computing all values $\lambda $ such that $A+\lambda B$ has a multiple eigenvalue,2014
Journal Article,"Niu D,Yuan X",An implicitly restarted Lanczos bidiagonalization method with refined harmonic shifts for computing smallest singular triplets,2014
Journal Article,"Zhang H,Ding F",A property of the eigenvalues of the symmetric positive definite matrix and the iterative algorithm for coupled Sylvester matrix equations,2014
Journal Article,"Arangala C,Lee JT,Borden C",Seriation algorithms for determining the evolution of \it The Star Husband Tale,2014
Journal Article,"Ryckelynck P,Smoch L",Quadratic choreographies,2014
Journal Article,"Ferranti M,Vandebril R",Computing eigenvalues of normal matrices via complex symmetric matrices,2014
Journal Article,"El Khoury G,Nechepurenko YM,Sadkane M",Acceleration of inverse subspace iteration with Newton's method,2014
Journal Article,"Aishima K,Matsuo T,Murota K,Sugihara M",A shift strategy for superquadratic convergence in the dqds algorithm for singular values,2014
Journal Article,Zhang LH,On a self-consistent-field-like iteration for maximizing the sum of the Rayleigh quotients,2014
Journal Article,"Yuan Y,Liu H",An iterative updating method for damped structural systems using symmetric eigenstructure assignment,2014
Journal Article,"Han L,Xu J",Proof of Stenger's conjecture on matrix $I^(-1)$ of sinc methods,2014
Journal Article,"Dykes L,Reichel L",Simplified GSVD computations for the solution of linear discrete ill-posed problems,2014
Journal Article,"Gerds P,Grasedyck L",Solving an elliptic PDE eigenvalue problem via automated multi-level substructuring and hierarchical matrices,2013
Journal Article,"Benner P,Boerm S,Mach T,Reimer K",Computing the eigenvalues of symmetric $\scr H^2$-matrices by slicing the spectrum,2013
Journal Article,Mach T,Computing inner eigenvalues of matrices in tensor train matrix format,
Book,"McNamee JM,Pan V",Numerical methods for roots of polynomials. Part II,2013
Journal Article,"Zhu P,Knyazev A",Angles between subspaces and their tangents,2013
Journal Article,Mehrdoust F,A randomized algorithm for estimating the condition number of matrices,2013
Journal Article,Huang LP,Inexact Newton method for computing the smallest eigenvalue of a large symmetric positive definite Toeplitz matrix,2013
Journal Article,"Mert C,Milnikov A,Prangishvili A",Tensor approximation approach to calculation of singular values and vectors for SVD problem,2013
Journal Article,"Castelli R,Lessard JP",A method to rigorously enclose eigenpairs of complex interval matrices,
Journal Article,Ikramov KD,An efficient algorithm for computing the pseudoeigenvalues of complex matrices that are selfadjoint in a symplectic metric,2013
Journal Article,"Tang H,Wang S",Robust joint block diagonalization based convolutive blind source separation,2013
Journal Article,"Cai JF,Osher S",Fast singular value thresholding without singular value decomposition,2013
Journal Article,"Xu WW,Liu H",Perturbation bounds of partitioned Hermitian generalized eigenvalue problems,2013
Journal Article,"Gao JQ,Fan LY,Li L,Xu LZ",A practical application of kernel-based fuzzy discriminant analysis,2013
Journal Article,"Wu JP,Song JQ,Zhang WM,Zhao J",An efficient and accurate scheme for computing the Fiedler vector,2013
Journal Article,"Zhang L,Cao LQ",Higher-order multiscale Rayleigh quotient corrections to the eigenvalues of composite materials,2013
Journal Article,Tomei C,"The Toda lattice, old and new",2013
Journal Article,"Zhang LH,Yang WH",Perturbation analysis for the trace quotient problem,2013
Journal Article,"Ahmad SS,Mehrmann V","Backward errors for eigenvalues and eigenvectors of Hermitian, skew-Hermitian, $H$-even and $H$-odd matrix polynomials",2013
Journal Article,"Hu Y,Xie HQ",Orthogonal projection method for eigenpair derivatives of large symmetric matrices,2013
Journal Article,Segura J,Some analytical and numerical consequences of Sturm theorems,2013
Journal Article,"Liu P,Zhang SG,Li Q",Linear maps preserving the $q$th-degree numerical range of linear operators,2013
Journal Article,"Rendl F,Lisser A,Piacentini M","Bandwidth, vertex separators, and eigenvalue optimization",2013
Journal Article,"Shaini BI,Hoxha F",Computing generalized inverses using matrix factorizations,2013
Journal Article,"Khanh DC,Quyen HT,Thanh DD",On computing stabilizability radii of linear time-invariant continuous systems,2013
Journal Article,"Halikias G,Galanis G,Karcanias N,Milonidis E","Nearest common root of polynomials, approximate greatest common divisor and the structured singular value",2013
